{
  "policy_version": "analysis_policy_v2",
  "finding_type_registry": [
    {
      "finding_type": "revenue_decline",
      "domain": "sales",
      "allowed_directions": ["negative"],
      "allowed_severities": ["critical", "important"],
      "allowed_scopes": ["account"],
      "required_metric_codes": ["revenue_7d", "revenue_previous_7d", "revenue_delta_pct"],
      "actionable": true
    },
    {
      "finding_type": "revenue_growth",
      "domain": "sales",
      "allowed_directions": ["positive"],
      "allowed_severities": ["watch", "none"],
      "allowed_scopes": ["account"],
      "required_metric_codes": ["revenue_7d", "revenue_previous_7d", "revenue_delta_pct"],
      "actionable": false
    },
    {
      "finding_type": "orders_decline",
      "domain": "sales",
      "allowed_directions": ["negative"],
      "allowed_severities": ["critical", "important"],
      "allowed_scopes": ["account"],
      "required_metric_codes": ["orders_7d", "orders_previous_7d", "orders_delta_pct"],
      "actionable": true
    },
    {
      "finding_type": "orders_growth",
      "domain": "sales",
      "allowed_directions": ["positive"],
      "allowed_severities": ["watch", "none"],
      "allowed_scopes": ["account"],
      "required_metric_codes": ["orders_7d", "orders_previous_7d", "orders_delta_pct"],
      "actionable": false
    },
    {
      "finding_type": "average_order_value_decline",
      "domain": "sales",
      "allowed_directions": ["negative"],
      "allowed_severities": ["important", "watch"],
      "allowed_scopes": ["account"],
      "required_metric_codes": ["average_order_value_7d"],
      "actionable": true
    },
    {
      "finding_type": "average_order_value_growth",
      "domain": "sales",
      "allowed_directions": ["positive"],
      "allowed_severities": ["watch", "none"],
      "allowed_scopes": ["account"],
      "required_metric_codes": ["average_order_value_7d"],
      "actionable": false
    },
    {
      "finding_type": "sales_stable",
      "domain": "sales",
      "allowed_directions": ["neutral"],
      "allowed_severities": ["none", "watch"],
      "allowed_scopes": ["account"],
      "required_metric_codes": ["revenue_7d", "orders_7d", "revenue_delta_pct", "orders_delta_pct"],
      "actionable": false
    },
    {
      "finding_type": "traffic_decline",
      "domain": "funnel",
      "allowed_directions": ["negative"],
      "allowed_severities": ["important", "watch"],
      "allowed_scopes": ["account", "funnel"],
      "required_metric_codes": ["impressions_7d"],
      "actionable": true
    },
    {
      "finding_type": "impression_to_view_decline",
      "domain": "funnel",
      "allowed_directions": ["negative"],
      "allowed_severities": ["important", "watch"],
      "allowed_scopes": ["account", "funnel"],
      "required_metric_codes": ["impression_to_view_pct"],
      "actionable": true
    },
    {
      "finding_type": "view_to_cart_decline",
      "domain": "funnel",
      "allowed_directions": ["negative"],
      "allowed_severities": ["important", "watch"],
      "allowed_scopes": ["account", "funnel"],
      "required_metric_codes": ["view_to_cart_pct"],
      "actionable": true
    },
    {
      "finding_type": "cart_to_order_decline",
      "domain": "funnel",
      "allowed_directions": ["negative"],
      "allowed_severities": ["important", "watch"],
      "allowed_scopes": ["account", "funnel"],
      "required_metric_codes": ["cart_to_order_pct"],
      "actionable": true
    },
    {
      "finding_type": "order_to_delivery_decline",
      "domain": "funnel",
      "allowed_directions": ["negative"],
      "allowed_severities": ["important", "watch"],
      "allowed_scopes": ["account", "funnel"],
      "required_metric_codes": ["order_to_delivered_pct"],
      "actionable": true
    },
    {
      "finding_type": "funnel_conversion_improved",
      "domain": "funnel",
      "allowed_directions": ["positive"],
      "allowed_severities": ["watch", "none"],
      "allowed_scopes": ["account", "funnel"],
      "required_metric_codes": ["cart_to_order_pct", "view_to_cart_pct", "impression_to_view_pct"],
      "actionable": false
    },
    {
      "finding_type": "stockout",
      "domain": "stock",
      "allowed_directions": ["negative"],
      "allowed_severities": ["critical", "important"],
      "allowed_scopes": ["sku"],
      "required_metric_codes": ["available_stock_units", "stock_status"],
      "actionable": true
    },
    {
      "finding_type": "critical_coverage",
      "domain": "stock",
      "allowed_directions": ["negative"],
      "allowed_severities": ["critical", "important"],
      "allowed_scopes": ["sku"],
      "required_metric_codes": ["stock_coverage_days_7d", "stock_status"],
      "actionable": true
    },
    {
      "finding_type": "short_coverage",
      "domain": "stock",
      "allowed_directions": ["negative"],
      "allowed_severities": ["important", "watch"],
      "allowed_scopes": ["sku"],
      "required_metric_codes": ["stock_coverage_days_7d"],
      "actionable": true
    },
    {
      "finding_type": "no_sales_with_stock",
      "domain": "stock",
      "allowed_directions": ["negative"],
      "allowed_severities": ["important", "watch"],
      "allowed_scopes": ["sku"],
      "required_metric_codes": ["days_without_sales", "available_stock_units"],
      "actionable": true
    },
    {
      "finding_type": "slow_turnover",
      "domain": "stock",
      "allowed_directions": ["negative"],
      "allowed_severities": ["important", "watch"],
      "allowed_scopes": ["sku"],
      "required_metric_codes": ["average_daily_sales_30d", "stock_coverage_days_30d"],
      "actionable": true
    },
    {
      "finding_type": "surplus",
      "domain": "stock",
      "allowed_directions": ["negative"],
      "allowed_severities": ["important", "watch"],
      "allowed_scopes": ["sku"],
      "required_metric_codes": ["stock_status", "stock_coverage_days_30d"],
      "actionable": true
    },
    {
      "finding_type": "coverage_healthy",
      "domain": "stock",
      "allowed_directions": ["positive", "neutral"],
      "allowed_severities": ["none", "watch"],
      "allowed_scopes": ["sku", "account"],
      "required_metric_codes": ["stock_coverage_days_7d"],
      "actionable": false
    },
    {
      "finding_type": "high_drr_campaign",
      "domain": "advertising",
      "allowed_directions": ["negative"],
      "allowed_severities": ["critical", "important"],
      "allowed_scopes": ["campaign"],
      "required_metric_codes": ["drr_pct", "campaign_drr_pct"],
      "actionable": true
    },
    {
      "finding_type": "spend_without_orders",
      "domain": "advertising",
      "allowed_directions": ["negative"],
      "allowed_severities": ["important", "watch"],
      "allowed_scopes": ["campaign"],
      "required_metric_codes": ["spend_7d", "conversion_pct"],
      "actionable": true
    },
    {
      "finding_type": "ad_share_growth",
      "domain": "advertising",
      "allowed_directions": ["negative"],
      "allowed_severities": ["important", "watch"],
      "allowed_scopes": ["account"],
      "required_metric_codes": ["ad_spend_share_of_total_revenue_pct", "ad_spend_share_of_total_store_revenue_pct"],
      "actionable": true
    },
    {
      "finding_type": "ad_share_decline",
      "domain": "advertising",
      "allowed_directions": ["positive"],
      "allowed_severities": ["watch", "none"],
      "allowed_scopes": ["account"],
      "required_metric_codes": ["ad_spend_share_of_total_revenue_pct", "ad_spend_share_of_total_store_revenue_pct"],
      "actionable": false
    },
    {
      "finding_type": "campaign_efficiency_improved",
      "domain": "advertising",
      "allowed_directions": ["positive"],
      "allowed_severities": ["watch", "none"],
      "allowed_scopes": ["campaign", "account"],
      "required_metric_codes": ["drr_pct", "ad_spend_share_of_attributed_revenue_pct"],
      "actionable": false
    },
    {
      "finding_type": "budget_concentration",
      "domain": "advertising",
      "allowed_directions": ["negative", "neutral"],
      "allowed_severities": ["important", "watch"],
      "allowed_scopes": ["campaign", "account"],
      "required_metric_codes": ["spend_7d", "ad_spend_7d"],
      "actionable": true
    },
    {
      "finding_type": "sku_orders_drop",
      "domain": "sku",
      "allowed_directions": ["negative"],
      "allowed_severities": ["important", "watch"],
      "allowed_scopes": ["sku"],
      "required_metric_codes": ["orders_7d", "orders_previous_7d", "orders_delta_pct"],
      "actionable": true
    },
    {
      "finding_type": "key_sku_stock_risk",
      "domain": "sku",
      "allowed_directions": ["negative"],
      "allowed_severities": ["critical", "important"],
      "allowed_scopes": ["sku"],
      "required_metric_codes": ["stock_coverage_days_7d", "revenue_share_pct"],
      "actionable": true
    },
    {
      "finding_type": "key_sku_growth",
      "domain": "sku",
      "allowed_directions": ["positive"],
      "allowed_severities": ["watch", "none"],
      "allowed_scopes": ["sku"],
      "required_metric_codes": ["revenue_7d", "revenue_delta_pct", "revenue_share_pct"],
      "actionable": false
    },
    {
      "finding_type": "key_sku_concentration",
      "domain": "sku",
      "allowed_directions": ["negative", "neutral"],
      "allowed_severities": ["important", "watch"],
      "allowed_scopes": ["sku", "account"],
      "required_metric_codes": ["revenue_share_pct"],
      "actionable": true
    },
    {
      "finding_type": "category_underperformance",
      "domain": "category",
      "allowed_directions": ["negative"],
      "allowed_severities": ["important", "watch"],
      "allowed_scopes": ["category"],
      "required_metric_codes": ["revenue_7d", "revenue_delta_pct", "orders_7d"],
      "actionable": true
    },
    {
      "finding_type": "category_growth",